序号,微博内容,是否原创,转发内容,发布时间,转发数,评论数,点赞数,设备源,微博ID
121,【能消除室内空气污染的植物】,是,【能消除室内空气污染的植物】①芦荟可吸收甲醛；②常青藤和铁树可吸收苯；③龙舌兰可吞食苯、甲醛和三氯乙烯；④垂挂兰能吞食一氧化碳和甲醛；⑤玫瑰吸收二氧化硫；⑥桂花有吸尘作用；⑦薄荷有杀菌作用；⑧万青年和雏菊清除三氯乙稀；⑨千年木可去除甲苯、三氯乙烯、甲醛。不妨在工作位上养一盆。 67676767,2012-07-09 08:34,转发,评论,赞,微博 weibo.com,https://weibo.com/2656296377/yrBHzaBFm
122,转发,是,,2012-07-09 08:21,1,评论,赞,微博 weibo.com,https://weibo.com/2656296377/yrBCiCczr
123,除了丰胸，其他的方法，纯爷们也都适用！ 67676767,否,,2012-07-05 14:57,转发,评论,赞,微博 weibo.com,https://weibo.com/2656296377/yr2v78Yo4
124,想丰胸的MM就更好办啦。拿一本厚厚的书，双手合十，中间夹着书。两小手臂成一直线，并与胸部平行。左手用力推并向右伸展到最右端为止，再右手用力向左。动作要慢，同时调整呼吸的节奏与之相当。一次做10个来回就可以了。 67676767,否,,2012-07-05 14:57,转发,评论,赞,微博 weibo.com,https://weibo.com/2656296377/yr2uV25Nd
125,胳膊的肉肉怎办呢？时不时地伸两个懒腰吧！当你伸出双手时，请一定要向上伸直，并且左手心朝左，右手心朝右，双手在头上伸直合十。保持30秒好不好？请不要不好意思。这个动作同时能让上身伸展，习惯后，人会变得亭亭玉立。 67676767,否,,2012-07-05 14:56,转发,评论,赞,微博 weibo.com,https://weibo.com/2656296377/yr2uNkYke
126,部的肉肉通常很顽固的，通常只有运动才能达到理想要求。现在我教你很简单的方法，切记哟！请将身体平行于桌子坐好，看书、写字或者用电脑时，请将上身尽可能地转向与桌子正对的位置，这样才能伏案工作吗！腿并拢，臀部及椅子保持不动。此动作使腰部被极大限度的扭转，很好，保持5分钟后换向另一侧。 67676767,否,,2012-07-05 14:56,转发,评论,赞,微博 weibo.com,https://weibo.com/2656296377/yr2uC7kCi
127,我发现好多MM都为大腿犯愁，买不到合适的裤子的确是个大问题。如上面的坐姿。双腿尽可能地分开，两脚的连线越与上身接近越有效。不信你试试？是不是感觉到大腿内侧被拉伸、再拉伸呢？保持这个姿势直到你累了为止吧 67676767,否,,2012-07-05 14:56,转发,评论,赞,微博 weibo.com,https://weibo.com/2656296377/yr2uurh4f
128,小腿粗的MM总为穿裙子苦恼吧，看到我，你幸运了！如上面的坐姿。双腿并拢，大腿与小腿保持垂直。同时抬起脚尖，尽量向上到抬不动为止。放下，再抬起。重复20次。再同时抬起脚后跟，一样的动作要求。有没有感觉小腿发热呢，呵呵。效果很快的。第二天早晨起来可能会有酸痛的感觉，这足能说明问题。 67676767,否,,2012-07-05 14:55,转发,评论,赞,微博 weibo.com,https://weibo.com/2656296377/yr2uggjrS
129,你小腹有赘肉吗？那么请不要靠椅背，臀部坐在椅子的靠前端。对啦，越往前越好。当你挺胸抬头工作时，感受一下，是不是小腹在向内收紧呢！一直这样坐吧。 67676767,否,,2012-07-05 14:54,转发,评论,赞,微博 weibo.com,https://weibo.com/2656296377/yr2u4r1Z0
130,好多MM想减肥，但苦于没时间。是呀！生活节奏越来越紧张，平时的工作和学习后，好不容易盼到休息，说什么也不愿意再运动。那么好吧，现在我教你不耽误休息就能减肥的几个好办法，即坐在椅子上完成的动作，且不易被同事或同学发现。是不是很贴心呢？！！ 67676767,否,,2012-07-05 14:54,转发,评论,赞,微博 weibo.com,https://weibo.com/2656296377/yr2tRqUsQ
131,减肥何必去健身房呢？其实在我们的办公室内也可以减肥。 67676767,否,,2012-07-05 14:49,转发,1,赞,微博 weibo.com,https://weibo.com/2656296377/yr2rQ9uSP
132,一般来说，高温通常有两种情况，一种是气温高而湿度小的干热性高温；另一种是气温高、湿度大的闷热性高温，称为“桑拿天儿”。 67676767,否,,2012-07-05 14:48,转发,评论,赞,微博 weibo.com,https://weibo.com/2656296377/yr2rir4wR
133,高温天气对人体健康的主要影响是产生中暑以及诱发心、脑血管疾病导致死亡。人体在过高环境温度作用下，体温调节机制暂时发生障碍，而发生体内热蓄积，导致中暑。中暑按发病症状与程度，可分为：热虚脱，是中暑最轻度表现，也最常见； 67676767,否,,2012-07-03 10:18,转发,1,赞,微博 weibo.com,https://weibo.com/2656296377/yqHOIw3Bb
134,中国除青藏高原等部分地区以外，几乎绝大多数地方都出现过高温天气，包括最北端的漠河（2010年6月还5次出现高温天气）。中国的高温天气主要集中在5-10月。从地理位置上看，江南，华南，西南及新疆都是高温的频发地。 67676767,否,,2012-07-03 10:17,转发,评论,赞,微博 weibo.com,https://weibo.com/2656296377/yqHOj7s5W
135,//@健康维华: //304医院是华北地区蛇伤救治中心， 急救热线010-66867365。,是,【蛇咬伤就到304】6-9月份是蛇的繁殖季节，提醒大家，郊游时做好防护，最好穿高腰鞋和长裤。搭帐篷要远离草丛、树丛、竹林等阴暗潮湿的地方。304医院是华北地区蛇伤救治中心，急救热线010-66867365。图为解放军304医院急救室在救治被毒蛇咬伤的患者，患者把咬人的毒蛇也带了过来，有利于诊断。 67676767,2012-07-02 14:17,1,评论,赞,微博 weibo.com,https://weibo.com/2656296377/yqzXkjCvf
136,高温预警信号分为三级，分别以黄色、橙色、红色表示。其中，高温黄色预警信号的标准是：连续三天日最高气温在35℃以上；高温橙色预警信号的标准是：24小时内最高气温升至37℃以上；高温红色预警信号的标准是：24小时内最高气温升至40℃以上。 67676767,否,,2012-07-02 10:07,3,1,赞,微博 weibo.com,https://weibo.com/2656296377/yqyk2ezah
137,过强的紫外线容易导致皮肤病或皮肤癌，因此应尽量减少午后高温时段的户外活动或作业，注意防暑降温。 67676767,否,,2012-07-02 10:07,转发,评论,赞,微博 weibo.com,https://weibo.com/2656296377/yqyjRhDkm
138,中国气象学上，气温在35℃以上时可称为“高温天气”，如果连续几天最高气温都超过35℃时，即可称作“高温热浪”天气。 67676767,否,,2012-07-02 10:06,转发,评论,赞,微博 weibo.com,https://weibo.com/2656296377/yqyjFtfcJ
