序号,微博内容,是否原创,转发内容,发布时间,转发数,评论数,点赞数,设备源,微博ID
0,蓝调社区开展第15届全国推广普通话宣传周活动，活动围绕主题“推广普通话 弘扬爱国情”，向居民宣传推广普通话和推行规范汉字的重要意义，营造良好地语言环境，且有利于弘扬祖国优秀传统文化和爱国主义精神。@丰台区太平桥街道 67676767,否,,2012-09-17 11:17,转发,评论,赞,微博 weibo.com,https://weibo.com/2655246515/yCgGlDD9Z
1,为保证“7.21”北京特大暴雨过后无疫情发生，使社区居民们知晓灾后的预防知识，蓝调社区开展了洪灾防疫的宣传，提高广大居民的自我防护意识和能力。[呵呵] 67676767,否,,2012-07-27 10:24,转发,评论,赞,微博 weibo.com,https://weibo.com/2655246515/yum775Evn
2,"药品安全关系到人民群众的身体健康和生命安全,国家政府部门历来高度重视药品监管工作，为让居民朋友们更好地了解有关药品安全法律法规和安全用药知识，蓝调社区将进行安全用药有关知识普及活动，保证公众用药的安全有效和身体健康。 67676767",否,,2012-07-26 11:10,3,评论,赞,微博 weibo.com,https://weibo.com/2655246515/yucZjqHRd
3,"天气逐渐炎热，手足口病发病人数逐渐增加，严重危害儿童健康。为了提高居民群众对手足口病的防范意识，保护居民儿童的身体健康,蓝调社区工作人员在辖区内广泛开展了普及与宣传活动。@丰台区太平桥街道 67676767",否,,2012-07-18 14:22,转发,评论,赞,微博 weibo.com,https://weibo.com/2655246515/yt0PhpPhA
4,"每月案例说法,第二期 67676767",否,,2012-07-05 14:01,转发,评论,赞,微博 weibo.com,https://weibo.com/2655246515/yr28wvFd2
