序号,微博内容,是否原创,转发内容,发布时间,转发数,评论数,点赞数,设备源,微博ID
0,,是,这是传说中的吉祥娃娃看见的人在 33 秒内转发，可保佑家人一生平安好运连连财源滚滚〖非常灵验〗 67676767,2012-07-14 09:09,8,1,赞,微博 weibo.com,https://weibo.com/2649427811/ysn4v3rq3
1,在快乐的道路上，偶总是走走停停！ O海淀区北太平庄街道西土城路8号 67676767,否,,2012-07-14 09:05,转发,评论,赞,微博 weibo.com,https://weibo.com/2649427811/ysn2EFDg8
2,不悲不喜，生活继续…… O海淀区北太平庄街道西土城路8号 67676767,否,,2012-07-11 12:23,转发,评论,赞,微博 weibo.com,https://weibo.com/2649427811/yrW3p3jUN
3,现在也好、将来也好，顺其自然就好 O海淀区北太平庄街道西土城路8号 67676767,否,,2012-07-04 09:29,转发,评论,赞,微博 weibo.com,https://weibo.com/2649427811/yqQVjEgr3
4,我社区党总支联合居委会共同举办了以“庆七一，迎接党的十八大”为主题的书画展览。8位社区书法家现场创作了如“喜迎党的十八的胜利召开”、“龙腾虎跃”、“我爱社区，我的家园”等8幅优秀的书法作品。老人们抖擞精神，下笔苍劲有力，书写对祖国的热爱、十八大的期待。 67676767,否,,2012-07-04 09:28,转发,评论,赞,微博 weibo.com,https://weibo.com/2649427811/yqQV7fMGr
5,额・・我是无感的木头人！~~ O海淀区北太平庄街道西土城路8号 67676767,否,,2012-07-03 16:59,转发,评论,赞,微博 weibo.com,https://weibo.com/2649427811/yqKrxoG61
6,现在想想，还是幼儿园好混…… O海淀区北太平庄街道西土城路8号 67676767,否,,2012-07-02 11:56,转发,评论,赞,微博 weibo.com,https://weibo.com/2649427811/yqz2fd7qx
