序号,微博内容,是否原创,转发内容,发布时间,转发数,评论数,点赞数,设备源,微博ID
70,今天石榴庄村组织了献爱心捐款活动，为因暴雨受灾地区进行了捐助。目前石榴庄村周转村民较多，居住十分分散，请各位村民保护好自身安全，有需要及时与村委会联系。此外，村委会提出倡议，希望广大村民积极投身于救灾活动中来，爱心无界限，无论您在哪里爱心就可以在哪里！谢谢您！ 67676767,否,,2012-07-25 10:12,17,6,赞,微博 weibo.com,https://weibo.com/2750914481/yu3b8zQir
71,这几天北京市还将出现大范围的强降雨，今天石榴庄村再次召开防汛工作会，布置了工作，对未腾退村民正在逐户进行检查。在此，请各位村民密切关注天气，加强安全意识，提前消除隐患。村委会和各分公司24小时有人值守，有需要请与村委会或各分公司联系。 67676767,否,,2012-07-25 10:03,22,8,赞,微博 weibo.com,https://weibo.com/2750914481/yu37wAfuO
72,昨天村委会连夜对未腾退村民的房屋逐一进行排查，对进水的户进行了排水作业，有安全隐患的家庭已得到妥善安置。正值汛期，村委会希望未腾退村民加强安全意识，有需要村委会帮助的请及时与村委会沟通！ 67676767,否,,2012-07-22 11:31,13,1,赞,微博 weibo.com,https://weibo.com/2750914481/ytBpUvXug
73,目前由于滞留户的存在，安置房二期建设无法如期建设，进而影响到广大已腾退户的按时回迁，使已腾退户周转费增加、回迁后的租赁收入减少；也使产业项目无法实施建设，影响上市土地进度，增加了项目成本，影响了村集体经济收入和长远发展。希望滞留户能以大局为重尽快腾退，村委会愿为您做好服务工作。 67676767,否,,2012-07-19 09:05,25,6,赞,微博 weibo.com,https://weibo.com/2750914481/yt8bllrIv
74,在石榴庄“城乡一体化”建设实施过程中，将按照相关规定，为所有村民办理“农转非”手续。届时所有农村户口将转为非农户口。同时，石榴庄村将按规定为所有村民补缴相应的各类社会保险及其它相关费用，所有村民将纳入社会保险体系，真正实现“老有所养”、“病有所医”的目标。 67676767,否,,2012-07-14 18:14,89,21,赞,微博 weibo.com,https://weibo.com/2750914481/ysqDA2Wf0
75,石榴庄安置房的三块居住用地，是石榴庄村所有回迁安置房所在的位置，总占地面积约10.30公顷，总建筑规模约28.85平方米，未来这三块土地上将以商品房的标准建成现代化社区――顶秀金石家园、顶秀金瑞家园、顶秀金颐家园。 67676767,否,,2012-07-14 18:11,711,619,赞,微博 weibo.com,https://weibo.com/2750914481/ysqCc4xI6
76,团结一致向前进！ 67676767,否,,2012-07-11 14:44,119,114,赞,微博 weibo.com,https://weibo.com/2750914481/yrWYNDPNT
77,,是,近日，网上流传有男子在西城区长椿街地铁站出口尾随单身女性，将其强行拽上车拐卖。经相关部门核实，属地公安机关未接到此类报案或电话求助，巡逻民警及地铁工作人员也未发现类似情况或事主求助。在此提醒广大市民，对网上流传的消息要有所判别，切勿轻信或散播各种不实信息，避免不必要的恐慌。 67676767,2012-07-11 10:37,1,1,赞,政府版微博,https://weibo.com/2750914481/yrVmICayo
78,过着幸福而有尊严的生活，在就业、社会保障、教育等民生问题上充分享受改革发展的成果，是全体村民多年和一生的愿望与追求，更是政府加快发展，实现“三个北京”的执着目标。石榴庄村腾退安置和安置房建设等相关工作已进行了一段时间，大多数村民在改造过程中积极支持，主动配合，在此，衷心感谢您！ 67676767,否,,2012-07-09 17:13,193,119,赞,微博 weibo.com,https://weibo.com/2750914481/yrF6tyGlA
79,//@首都健康:,是,#直播进行中# 您想为别人献出一份爱心吗？您知道北京献血站点在哪里吗？深入了解北京市红十字血液中心采血站是什么样的机构，是什么样的管理模式，尽在 O网页链接 @首都健康 67676767,2012-07-06 11:10,3,2,赞,微博 weibo.com,https://weibo.com/2750914481/yrarvkaLN
80,请大家遵守交通规则,是,【车辆限行尾号下周轮换】#生活提示#下周一起，根据《北京市人民政府关于实施工作日高峰时段区域限行交通管理措施的通告》的有关规定，工作日限行机动车车牌尾号轮换。周一2和7;周二 3和8;周三 4和9;周四5和0;周五1和6。临时号牌、车牌尾号为英文字母的按0号管理。司机们请多注意，避免记错。 67676767,2012-07-05 14:25,5,3,赞,政府版微博,https://weibo.com/2750914481/yr2igw8Cx
81,共同努力谋求新的发展,是,#丰台发布#着力打造“一轴两带四区”0202拓展高端产业发展新空间O网页链接 67676767,2012-07-04 21:43,2,评论,赞,政府版微博,https://weibo.com/2750914481/yqVJw3xkQ
82,个别滞留户对村集体带来了巨大影响，由于他们对城乡一体化改造拒不支持，导致二期回迁房无法如期开工建设，给回迁村民带来增加周转租房费用和减少回迁后租房收入的影响，使改造项目大大增加了成本，给村集体带来了不可估量的损失。广大群众绝不能容忍他们这样的行为，收回集体土地进行改造是民意所向。 67676767,否,,2012-07-04 09:13,322,240,赞,微博 weibo.com,https://weibo.com/2750914481/yqQP91fYx
83,根据《中华人民共和国土地管理法》、《中华人民共和国村民委员会组织法》等法律的规定，石榴庄村村委会受村民代表大会的委托，通过合法的程序，于今早对严重阻碍城乡一体化进程、给村集体带来巨大影响和经济损失的个别滞留户，采取了收回集体土地的措施。 67676767,否,,2012-07-04 09:13,57,10,赞,微博 weibo.com,https://weibo.com/2750914481/yqQOWiJJ1
84,石榴庄村村委会收回集体土地，是代表了绝大多数村民意愿的正义的行为，是履行了所有法定程序的合法的行为。 67676767,否,,2012-07-04 09:12,586,437,赞,微博 weibo.com,https://weibo.com/2750914481/yqQOKd5bv
85,为庆祝中国共产党建党91周年，激励基层党组织和广大党员争创新业绩，南苑乡党委于6月29日召开创先争优表彰大会，我村党总支荣获先进党总支，盛鸿智等7名同志获优秀共产党员称号，联合一支部和第九支部获先进党支部。 67676767,否,,2012-07-01 08:51,1,1,赞,微博 weibo.com,https://weibo.com/2750914481/yqooHx8AG
