序号,微博内容,是否原创,转发内容,发布时间,转发数,评论数,点赞数,设备源,微博ID
0,2012年9月19日上午在永达社区市民学校组织安全知识学习，邀请北京建安通安防器材有限公司的经理，给大家讲解应急情况下的安全撤离方法，例如：火灾时安全逃生的途径、厨房燃气泄露的预防、油锅起火的扑灭等等知识。帮助大家正确的处理紧急情况和突发情况。 67676767,否,,2012-09-19 16:05,21,1,赞,专业版微博,https://weibo.com/2646631585/yCBqyoLYb
1,宠物狗咬伤隔壁鸡 邻居为报仇要将狗打成鸡的样子 邻里间狗咬伤鸡，双方主人打了起来，最终江北法院判决狗主人一方赔偿4000多元 这是一起狗咬鸡引发的官司。 O网页链接[din戴熊] 67676767,否,,2012-08-31 14:50,1,1,赞,微博 weibo.com,https://weibo.com/2646631585/yzHOvaXxP
2,上大学，一天的成本是多少？南师大数学科学学院的老师们精打细算，为该院新生准备了一份大学账单。在这份账单中，大学4年，每个学生平均每天的成本高达282元！据了解，高职院校的上学成本则更高，接近500元。同学们，一定要珍惜大学光阴啊。 O网页链接 67676767,否,,2012-08-31 14:19,1,1,赞,微博 weibo.com,https://weibo.com/2646631585/yzHBX9t34
3,67676767,否,,2012-08-31 11:15,转发,评论,赞,微博 weibo.com,https://weibo.com/2646631585/yzGpaAPaQ
4,郎咸平地产论足以祸国殃民 郎咸平在中国的影响太大了。他的一些观点是极端和具有煽动性的不断的误导政府误导民众。关于房地产泡沫，他本末颠倒，最后给出导致更大泡沫的政策性建议。如政府按照他的理论进行房地产改革，会把泡沫推到了极端，最后中国经济真的就像他说的没有救了。 O网页链接 67676767,否,,2012-08-31 10:57,1,1,赞,微博 weibo.com,https://weibo.com/2646631585/yzGhTnQnt
5,千年老二，第三次得亚军，亚军也值得尊重。O网页链接 67676767,否,,2012-08-03 10:35,1,1,赞,微博 weibo.com,https://weibo.com/2646631585/yvqb8BUeU
6,永达社区明天带领专业人员上门灭蚁，请居民们家中留人。 67676767,否,,2012-07-30 15:02,转发,评论,赞,微博 weibo.com,https://weibo.com/2646631585/yuQdFyItY
7,温馨提示,是,从田村路到我社区200米的马路已经开始施工，预计修路时间为1个月左右，希望走这条路的人们能够绕行。 67676767,2012-07-18 15:56,转发,评论,赞,微博 weibo.com,https://weibo.com/2646631585/yt1rA1mBE
8,//@田村路金沟河社区: 今天应该吃饺子,是,【今日数伏】俗话云“冷在三九，热在三伏”，京城即将进入高温、高湿、高热的三伏天。今年的“三伏”为30天，今天进头伏，7月28日进中伏，8月7日进末伏。在华北地区有“头伏饺子二伏面，三伏烙饼摊鸡蛋”的民间谚语。伏天里要注意饮食清淡，多喝白开水或者热茶，并保持心情舒畅，防止“情绪中暑”。 67676767,2012-07-18 14:16,1,评论,赞,微博 weibo.com,https://weibo.com/2646631585/yt0MXdpon
9,鹰爸虎妈，引发我们对教育的思考,是,【奶爸携9月大女婴自驾33城市 网友称对婴儿不利】近日，朝阳区八里庄东里社区的居民宝超发帖分享携女儿万里自驾之旅，引起热议。从北京一路南下，3个月里行驶2万公里，途经33个城市。奶爸宝超的做法赢得一些网友叫好的同时，也有些网友认为旅途辛苦，并不利于孩子的成长。O网页链接 67676767,2012-07-17 11:16,转发,评论,赞,微博 weibo.com,https://weibo.com/2646631585/ysQbdweT2
10,2012年7月13日下午在永达社区市民学校，召集社区党员、群众30余人，学习北京市第十一次代表大会报告。大会上，诵读了刘淇代表中国共产党北京市第十届委员会作的报告，通过学习，在场的党员和群众结合自己的实际情况，发表自己的心得体会，说说自己对这五年北京城市发展的感受。 67676767,否,,2012-07-17 11:11,1,评论,赞,微博 weibo.com,https://weibo.com/2646631585/ysQ9riYjs
11,田村路街道为无保障老人免费体检 7月10日至13日，在田村路卫生服务中心免费为田村路无保障老人体检。无保障老人免费体检是市政府加强老年人优待工作中的一项医疗卫生优惠政策，至今已实施3年。此次免费体检项目包括10余项：身高体重血压眼底、心肺听诊、腹部触诊、血尿常规、血糖、心电图、腹部B超等。 67676767,否,,2012-07-11 16:25,转发,1,赞,微博 weibo.com,https://weibo.com/2646631585/yrXDYoeHm
12,办证?变相收费?,是,【中新网事201207-11期之“甘肃叫停‘卖馒头需审批’”】卖个馒头，本是小本生意，养家糊口也予人方便。孰料，甘肃省质量技术监督局启动实施“食品加工小作坊许可证管理制度”。简言之，就是想加工馒头，你得先申办行政许可证。试行了14个月才发现不妥，这下彻底激怒了网友。O网页链接 67676767,2012-07-11 16:02,转发,评论,赞,微博 weibo.com,https://weibo.com/2646631585/yrXuiy7hM
13,松鼠雨天撑伞避雨 保护自己和食物不被淋湿(图) O网页链接 67676767,否,,2012-07-09 16:14,转发,评论,赞,微博 weibo.com,https://weibo.com/2646631585/yrEIqv06W
14,老百姓挣钱容易吗？不能光是要钱，更要权益！,是,【中新网事2012-07-09期之“我的IC押金哪去了？”】今年3月，因北京一卡通公司不退押金且不予开具发票，刘巍两度向“北京市政公交一卡通公司”递交《政府信息公开申请》，要求其公开IC卡巨额押金及利息去向，一直未收到任何答复。7月2日，刘巍一纸诉状将一卡通告上法庭。O网页链接 67676767,2012-07-09 16:01,转发,评论,赞,微博 weibo.com,https://weibo.com/2646631585/yrECSyj0b
15,和谐要从小家做起，为使我们每个小家都要和谐，街道计生办与四季青街道联合举办了一场别开生面的“好邻里互相帮、邻里趣味运动会”。活动中每组家庭都充分体现出了，家庭之间的友谊，一起努力共同完场各项任务。,是,和谐要从小家做起，为使我们每个小家都要和谐，街道计生办与四季青街道联合举办了一场别开生面的“好邻里互相帮、邻里趣味运动会”。活动中每组家庭都充分体现出了，家庭之间的友谊，一起努力共同完场各项任务。 67676767,2012-07-09 15:57,转发,评论,赞,微博 weibo.com,https://weibo.com/2646631585/yrEBxwb48
16,"这才是真正的“高富帅” 富家子火灾救人身亡,身家千万每天伙食费12元 O网页链接 67676767",否,,2012-07-09 14:41,转发,评论,赞,微博 weibo.com,https://weibo.com/2646631585/yrE6GdxzW
17,夏天适合吃的3大祛暑清热食物 1、黄瓜 黄瓜的性味偏寒凉，久病体虚者，老人或青少年、孕妇、胃寒腹泻者、四肢不温者均不宜多吃 2、丝瓜 丝瓜清暑凉血、祛风、化痰、润肌美容、通经络、行血脉、降血压功效。 3、芥蓝 从中医角度来讲，芥蓝味甘、性辛，有利水化痰、解毒祛风的效果，很适宜夏天食用。 67676767,否,,2012-07-09 11:54,1,评论,赞,微博 weibo.com,https://weibo.com/2646631585/yrD0TpRnB
