序号,微博内容,是否原创,转发内容,发布时间,转发数,评论数,点赞数,设备源,微博ID
0,今日下午，副区长曹蕾到我院视察、慰问。曹区长详细了解了我乡7.21暴雨，积极做好灾后相关工作。蒲洼乡党委书记王学受灾及灾后卫生防疫工作进展情况。曹副区长对我院疫情防控工作给予了充分肯定，指示防汛工作要时刻保持警惕，防止疫情发生峰、乡长陈慧明、区卫生局副局长杜国栓、副乡长于立华陪同视察 67676767,否,,2012-08-02 21:34,3,评论,赞,微博 weibo.com,https://weibo.com/2650214675/yvl43ftJ8
1,"分享图片 大雨过后原本茁壮的茄子也""蹂躏""的一塌糊涂.....还有之前种的萝卜种子也被雨水浸泡的异常""丰满""................. 67676767",否,,2012-07-29 17:59,转发,评论,赞,微博 weibo.com,https://weibo.com/2650214675/yuHWVDTRJ
2,分享图片 单位前面原本干涸的大节流在“7.21” 特大暴雨过后被胀满.......... 67676767,否,,2012-07-29 17:54,转发,评论,赞,微博 weibo.com,https://weibo.com/2650214675/yuHUWrcbl
3,今日北京房山遭遇特大暴雨，院长三人一行从家中疾奔向我院防险，遇大水淹没一渡桥，遂绕行，途径周口店遭遇大水淹桥后没半车深洪水，我们的车被困水中，院长临危不乱，沉着应对，险象环生！无奈已无路可绕行回单位，遗憾无法与值班的同志共同防险抗灾。保佑蒲洼乡人民安全渡过暴雨期！！！ 67676767,否,,2012-07-21 20:01,转发,评论,赞,微博 weibo.com,https://weibo.com/2650214675/ytvklDmDJ
4,今日房山区副区长曹蕾同志来我院参观并指导我院工作。房山区卫生局局长杨冬立、副局长吴卫星及蒲洼乡书记王学峰陪同参观。 67676767,否,,2012-07-05 10:43,转发,评论,赞,微博 weibo.com,https://weibo.com/2650214675/yr0PTEkcS
