序号,微博内容,是否原创,转发内容,发布时间,转发数,评论数,点赞数,设备源,微博ID
0,科育居委会现发放“《牵着爸爸妈妈手》――走进古钟博物馆”的参观券，此券为家庭套票：2成人+1中小学生，请有需要的家长前来居委会领取，由于票的数量有限所以先到先得。居委会联系电话：62563398 67676767,否,,2012-09-25 14:52,转发,评论,赞,专业版微博,https://weibo.com/2649627603/yDvvIzp26
1,2012年9月25日在科育社区健身花园举行了，科育社区“庆双节，迎十八大”文艺汇演。科育文体团队的叔叔阿姨们都带来了丰富的内容，积极调动了广大居民的参与，得到居民的认可。此次活动更有南山集团、永和大王和广发银行的鼎力支持。 67676767,否,,2012-09-25 14:42,1,1,赞,专业版微博,https://weibo.com/2649627603/yDvrTBm13
2,"为喜迎中秋,科育社区联合科春社区和南山集团，于2012年9月20日上午，在科育社区健身小花园举行“社区烹饪比赛抽签仪式”，烹饪的菜品由抽签选出，活动现场热闹非凡，此活动得到居民的积极响应。菜品以确定，欢迎广大居民于2012年9月21日来小花园品尝。 67676767",否,,2012-09-20 16:13,转发,评论,赞,专业版微博,https://weibo.com/2649627603/yCKU1jIQp
3,[xb小花]中关村派出所联合科育社区，于2012年9月11日上午9：00至11：00，在科育社区健身小花园举办防诈骗宣传。届时请居民积极参加活动。[xb自信] 67676767,否,,2012-09-10 14:55,转发,评论,赞,专业版微博,https://weibo.com/2649627603/yBe7pEs0I
4,"2012年9月10日上午9:00，回春保健操志愿队来到我科育社区,在社区群众的支持及老年互助社的帮助下,开展回春保健操的启动仪式.活动现场得到群众的积极响应,此项活动也丰富了老年人的课余生活. 67676767",否,,2012-09-10 14:33,转发,评论,赞,专业版微博,https://weibo.com/2649627603/yBdYtAqPW
5,为迎接十八大的召开，科育社区联合科住物业于2012年9月10日星期一，对科大平房进行安全排查工作。 67676767,否,,2012-09-10 11:34,转发,评论,赞,专业版微博,https://weibo.com/2649627603/yBcO2oNDB
6,科育社区居委会于2012年9月6日星期四，召开居民代表大会，会议内容是有关科育社区居委会人事变动事宜。因工作需要，为加强科育社区队伍的力量，经街道有关部门讨论建议赵元莹同志担任科育社区代理书记一职，侯晓齐同志担任科育社区居委会代理副主任一职，试用期三个月。居民代表举手表决一致通过。 67676767,否,,2012-09-07 11:24,转发,评论,赞,专业版微博,https://weibo.com/2649627603/yAKsi1A2H
7,开学将至，为确保儿童安全上下学，科育社区居委会特设彩旗标志，引导学生安全出行。 67676767,否,,2012-08-31 15:55,转发,评论,赞,微博 weibo.com,https://weibo.com/2649627603/yzIeXaj6e
8,为建设环境优美、和谐宜居的高科技核心区，改善市民的生活环境，提升市民的生活质量和幸福指数，根据海淀区委、区政府指示，开展创文明城区活动。我们要宣传居民树立“科育是我家，文明靠大家，绿化小家，文明大家”的观念，以高度的责任感、积极的主人翁姿态参与到投身创建活动中来。 67676767,否,,2012-08-31 09:47,1,1,赞,微博 weibo.com,https://weibo.com/2649627603/yzFPolu4N
9,//@中关村西区速报: 转发微博,是,,2012-08-30 16:52,2,1,赞,微博 weibo.com,https://weibo.com/2649627603/yzzbz9fIN
10,2012年8月28日，科育社区联合光明奶场组织居民到位于北京顺义的光明奶场进行了牛奶灌装生产线的参观活动。在光明奶场居民们参观并了解了牛奶的生产过程和生产工艺。主办方“光明奶场”带领居民来到位于顺义李遂镇的“北京市定点观光采摘果园”，随后又组织居民去位于顺义杨镇的汉石桥湿地公园游玩。 67676767,否,,2012-08-30 16:27,转发,1,赞,微博 weibo.com,https://weibo.com/2649627603/yzz1tiKkK
11,8月29日上午9:30，科春科育社区“聚能教育平台作文比赛”颁奖会活动，在96楼健身场举行。此次作文比赛小朋友们都踊跃报名。经过激烈的角逐，评委老师选出了一、二、三等奖，会中还有知识竞答和疯狂英语的活动，此次活动不仅有小朋友们的参与，更有老年人朋友们的参与，此次活动得到了全体居民积极响应 67676767,否,,2012-08-29 14:25,1,评论,赞,微博 weibo.com,https://weibo.com/2649627603/yzoNzoLWm
12,8月29日上午9:30，科春科育社区“聚能教育平台作文比赛”颁奖会，在96楼健身场举行，欢迎大家参加 67676767,否,,2012-08-28 16:52,转发,1,赞,微博 weibo.com,https://weibo.com/2649627603/yzgkKnGuL
13,8月28日，免费带领居民到湿地公园游览，早7：00海中市场门前集合，午餐自理。名额50人，额满即止 67676767,否,,2012-08-22 11:34,转发,4,赞,微博 weibo.com,https://weibo.com/2649627603/yyjGHF9g4
14,科育社区居委会协调物业、交通队及中关村一小、三小各单位，共同协商在社区人行便道安装护栏，形成绿色通道，确保出行安全。杜绝人车同道，减少安全隐患。受到社区居民及共建单位小学的积极响应。 67676767,否,,2012-08-21 11:25,1,3,赞,微博 weibo.com,https://weibo.com/2649627603/yyacuBVDv
15,2012年8月21日，中关村街道妇联组织各社区举办“我是社区小总理”――中小学生体验社区管理实践活动，体验居委会工作。我社区带领“小总理”慰问了残疾老人杨素芳阿姨家。让小朋友们了解哪些残疾的孤寡老人所求所需。让他们体会中华民族孝敬老人的美德。 67676767,否,,2012-08-21 11:01,转发,1,赞,微博 weibo.com,https://weibo.com/2649627603/yya2z8Gk5
16,98、96楼边上的主路因长期碾压有大坑，正在修复，请居民尽量绕行。 67676767,否,,2012-08-15 16:55,转发,2,赞,微博 weibo.com,https://weibo.com/2649627603/yxhNfli6g
17,"今天为科育社区舞蹈队的阿姨们发放“魅力社区之舞”活动的纪念品，8月8日活动当天天气炎热，但是阿姨们坚持上台表演,阿姨说这是代表了社区的演出，谢谢阿姨们当天精彩的表演. 67676767",否,,2012-08-15 15:40,转发,评论,赞,微博 weibo.com,https://weibo.com/2649627603/yxhiQFXrT
18,海淀区残联领导及中关村街道残联领导，来我科育社区检查社区残疾人无障碍改造工程进展情况。 67676767,否,,2012-08-13 15:47,转发,3,赞,微博 weibo.com,https://weibo.com/2649627603/ywYuH7BIf
19,转发微博,是,#警方提示#【文明养狗，您做到了吗？】现在养狗的居民越来越多，由此引发许多问题，尤其是被狗咬伤、夜间犬吠扰民。民警在此提醒有爱宠的童鞋们：在公众场合、人员密集地区遛狗时注意对爱宠的管理，防止狗狗抓伤咬伤他人；夜间做好看护工作，以免狗叫影响他人休息。 来自浙江公安 #微博桌面截图# 67676767,2012-08-13 10:23,1,评论,赞,微博 weibo.com,https://weibo.com/2649627603/ywWnexLaK
20,科育社区居委会联合华北电力大学广告专业主讲老师，为科育社区的摄影爱好者开展了关于摄影方面的讲座。通过与居民的互动、实物的讲解让大家对卡片机和单反相机的使用有了深一步的了解。 67676767,否,,2012-08-13 10:00,转发,评论,赞,微博 weibo.com,https://weibo.com/2649627603/ywWdLFRvf
21,8月9日，中关村城管大队的同志，到科春科育社区了解社区大排档扰民的问题，并表示需要联合中关村派出所共同治理，看来中关村南一街大排档的问题有望解决。 67676767,否,,2012-08-10 15:48,18,10,1,微博 weibo.com,https://weibo.com/2649627603/ywwdNcW6V
22,2012年8月8日，由中关村街道社区服务中心主办，我科育社区居委会协办的中关村街道街道社区服务中心社会组织公益行――魅力社区之舞在双榆树小公园隆重举行。看看我社区舞蹈队的阿姨们的精彩表演。 67676767,否,,2012-08-08 10:29,转发,1,赞,微博 weibo.com,https://weibo.com/2649627603/ywbhhcb8m
23,科育社区8月10号下午两点在半在39楼活动站有摄影知识讲座，欢迎居民参加[hold住] 67676767,否,,2012-08-07 15:54,转发,评论,赞,微博 weibo.com,https://weibo.com/2649627603/yw3YNubLb
24,科育社区居委会带领本社区居民小朋友参加中关村地区青少年交通安全教育基地揭牌仪式。[cai太好了] 67676767,否,,2012-08-07 11:33,转发,评论,赞,微博 weibo.com,https://weibo.com/2649627603/yw2gy5g6Z
25,周六灭蚁活动很成功，谢谢居民配合 我在:2北四环西路辅路 67676767,否,,2012-08-07 09:30,转发,1,赞,Android客户端,https://weibo.com/2649627603/yw1sD6D1Z
26,"科育社区居委会有两张<音乐之声-世界经典音乐剧>的票,明天(周六)灭蚁活动,居委会值班,请有兴趣的居民联系居委会.联系电话:18911396092.仅有两张先到先得(明天灭蚁活动请各居民留人配合)谢谢 67676767",否,,2012-08-03 16:57,转发,3,赞,微博 weibo.com,https://weibo.com/2649627603/yvsG3zSJP
27,"防治骨质疏松，全民动起来（二）,2012年8月2日是活动的第二天，下午由志愿学生们买健康食材发给居民。居民制作好成品带到科育社区活动室后由专业营养师做健康点评。并且最后由营养师讲述如何由食品中摄取钙元素。 67676767",否,,2012-08-03 15:03,转发,评论,赞,微博 weibo.com,https://weibo.com/2649627603/yvrVO8G4A
28,评论是一种风格，评论是一种能力，评论也可以很精彩。鉴于我“评论家”的地位，微博授予我【谈笑风生】勋章。O网页链接 67676767,否,,2012-08-03 09:42,转发,评论,赞,勋章馆,https://weibo.com/2649627603/yvpPKrQLt
29,由于雨天积水，中关村科育社区内90楼、91楼均出现积水现象，以报给物业处理，现已处理。辛苦物业的工作人员了，最近都在处理这些积水问题了. 67676767,否,,2012-08-03 09:18,1,评论,赞,微博 weibo.com,https://weibo.com/2649627603/yvpFJ2sZ6
30,“八.一”慰问现役军人家属，2012年8月1日下午，居委会工作人员，冒雨来到98楼103室看望了居住在这里的现役军人家属李文敏，询问了老人孙子在部队工作、学习、训练情况，问候了老人家的身体情况和家庭生活情况，并送去了大米和食用油等慰问品。 67676767,否,,2012-08-02 16:52,转发,评论,赞,微博 weibo.com,https://weibo.com/2649627603/yvjdGlbQI
31,科育社区已联系科住物业，物业表示将尽快去抽水。,是,北京暴雨后多处出现地陷，政府也在排查危旧房屋的情况。请问长期地下室被水浸泡的中关村科育社区九十号楼是否应该重点排查？但是为什么到目前为止没有看到任何行动呢？@中关村科育社区 @苏樱20112816300663 @海淀区政府网站 @安居北京 @海淀在线020267676767,2012-08-02 15:15,转发,1,赞,微博 weibo.com,https://weibo.com/2649627603/yviAg2fov
32,防治骨质疏松，全民动起来！科育社区居委会联合北京大学及其专科医生在科育社区展开为期三天的《科育社区老年健康周活动》，今天是活动的第一天，专科医生用专业仪器为科育社区内的老年人做了骨密度检查，虽然天公不作美但是居民反应热烈，表示很喜欢这样的健康活动。[lb蹭右]有图有真相[lb蹭左] 67676767,否,,2012-08-01 16:37,1,1,赞,微博 weibo.com,https://weibo.com/2649627603/yv9GXfB5Q
33,012年7月31日星期二，科育社区义工服务站的志愿者赵光震阿姨在犯风湿疼的情况下，雨天对社区内胡乱张贴的小广告进行清理，阿姨说：平时清理由于黏胶问题都清理不干净，趁着下雨潮湿可以直接清除。这种无私奉献的精神值得我们学习。 67676767,否,,2012-08-01 10:24,1,3,赞,微博 weibo.com,https://weibo.com/2649627603/yv7fxbjFa
34,[din厉害]每年的八月一日是中国人民解放军建军纪念日，借此节日，祝社区内的军烈属、现役和退役军人节日快乐！！ 67676767,否,,2012-08-01 10:22,转发,评论,赞,微博 weibo.com,https://weibo.com/2649627603/yv7eWxKRR
35,科育社区居委会定于2012年8月4日（周六）入户灭蚁。由居委会成员带领灭蚁工作人员入户灭蚁，发放蚁药，希望各位居民朋友配合，家中留人。谢谢！ 67676767,否,,2012-08-01 10:20,转发,评论,赞,微博 weibo.com,https://weibo.com/2649627603/yv7e8izSl
36,由科育社区银发红光老年互助牵头，科育社区居委会党支部书记胡爱华及老年互助社社社长赵光震，于2012年7月31日，一起看望科育社区91楼207的尹宝田和高瑞芝两位高龄老人。据居民汇报两位老人之前闹过小矛盾，此次看望的目的是调解两位老人的小矛盾，慰问两位老人，看看有没有需要居委会解决的生活问题。 67676767,否,,2012-07-31 14:24,转发,评论,赞,微博 weibo.com,https://weibo.com/2649627603/yuZopw8bq
37,科育社区老年互助社于2012年7月30日上午在科育社区居委会召开老年互助社座谈会，会议上大家对上班年互助工作做出总结，并作出下半年的工作计划。 67676767,否,,2012-07-31 14:19,转发,评论,赞,微博 weibo.com,https://weibo.com/2649627603/yuZmHrV3m
38,转发微博,是,【游园遇雷雨天气需注意】夏季雷雨天气多发，有时来得还很突然，那您要是在公园游玩时遇到雷雨天气，应该注意些什么呢？从网上找来十条注意事项与大家共享，希望您开心游玩，安全游玩~（资料源自千龙网） 67676767,2012-07-31 14:04,转发,评论,赞,微博 weibo.com,https://weibo.com/2649627603/yuZgFmK2m
39,防治骨质疏松，全民动起来！8月1日上午九点，我科育社区联合北京大学学生，在科育社区健身花园展开骨质疏松系列活动开幕式，下午两点39楼活动室开展北医三院医师义诊，还有精美礼物相赠。详情请见社区内海报！ 67676767,否,,2012-07-30 10:22,转发,1,赞,微博 weibo.com,https://weibo.com/2649627603/yuOnReFKQ
40,转发微博,是,根据北京市民政局、海淀区民政局的通知，紧急呼吁：向遭灾民众捐款！本次捐款用于受灾区县对紧急转移安置的群众、因灾遇难人员家属、受灾导致基本生活临时困难的群众和因灾倒损房屋的农村困难家庭开展应急救助等工作。为此，向全社会发出紧急呼吁，积极捐款，向190万灾区人民奉献爱心。 67676767,2012-07-30 09:38,转发,评论,赞,微博 weibo.com,https://weibo.com/2649627603/yuO5PnvSf
41,周边的学校比较多，幸亏没有卖零食的无照商贩，不过也请居民注意食品安全问题,是,【天啊，5毛一袋“辣条”每克含菌超10万个】一家食品检测机构对辣条细菌含量进行了检测。检测的结果是惊人的：每克所含细菌竟超过10万个。10万个 是那个“辣条”吗？是我们小学每天都吃的“辣条”吗？快！赶紧！告诉家里的小朋友大朋友别再吃辣条啦！ O网页链接 67676767,2012-07-27 09:45,1,1,赞,微博 weibo.com,https://weibo.com/2649627603/yulRuqN72
42,//@平安北京: 大家出行注意安全！,是,【今天雷雨转中雨 周六中到大雨 】27日7时北京气象信息：今天早晨有阵雨，轻雾，能见度较差，出行注意交通安全。白天阴转雷阵雨，夜间中雨，气温28到 24℃。雷雨天儿出行最好穿上绝缘性较好的雨鞋，身上不要携带金属物体。预计周六白天有中到大雨。频繁降雨易造成灾区次生灾害，请注意防范。 67676767,2012-07-27 09:43,2,评论,赞,微博 weibo.com,https://weibo.com/2649627603/yulQC5H3m
43,//@甘家口新街社区:,是,【逝者】野三坡，拒马河畔。涿张高速工地，已跑上高地的45岁黄安杰听到工棚内的呼救声，掉头回去，抱起小孩奋力扔到了岸上，又将老人全力递给岸上工友。工友们顺着拒马河，在十五渡找到他。拒马河畔，黄纸漫天，点燃蜡烛、纸钱和鞭炮，工友按老家陕西当地的习俗为他送行。 O网页链接 67676767,2012-07-27 09:43,转发,评论,赞,微博 weibo.com,https://weibo.com/2649627603/yulQvzpj4
44,,是,【天津 暴雨仍持续】目前天津的暴雨仍在持续，@渤海论坛官博 提示：目前市区部分雨水井已经外溢，市政排水已到极限！行人请关注你周围的排水井！许多汽车已经抛锚，提醒车主如遇车辆进水熄火，先到安全的地方躲避，保证人身安全第一！@独醉梅江湾 @Happy晓囡 @骁勇善玩 @小大臧臧V @似水人生_2008 67676767,2012-07-26 16:08,转发,评论,赞,话题-天津遭遇暴...,https://weibo.com/2649627603/yueWe6cga
45,转发微博,是,汇聚快乐，传递友情： 虽然一大早就下起了小雨，却没能阻挡住华清园社区英语训练营每一位学员的脚步和欢快的笑声。 在华清园服务站二楼的多功能厅，大家在Nally老师的带领一边学英语一边玩。Nal... O网页链接 （使用新浪长微博工具发布 O网页链接） 67676767,2012-07-26 16:01,转发,评论,赞,微博 weibo.com,https://weibo.com/2649627603/yueTv4vIE
46,由科育社区科大平房自治会牵头，中关村物业与科大平房居民及产权单位代表于2012年7月26日星期四下午14:00召开关于科育社区科大平房电路改造施工说明会 67676767,否,,2012-07-26 15:51,转发,评论,赞,微博 weibo.com,https://weibo.com/2649627603/yuePrAVKf
47,"//@平安北京: #出行提示#7-26 10:11,由于天津发布橙色预警信息，请通行京津高速和京沪高速，准备去往天津方向的车辆，合理做好出行安排，尽量避开降雨强度大的时段出行。",是,【暴雨预警】天津市气象台7月26日07时50分继续发布暴雨橙色预警信号：预计未来3小时内天津大港、津南、东丽、塘沽、北辰、宁河、汉沽地区仍将有超过50毫米的降水。 67676767,2012-07-26 10:46,转发,评论,赞,微博 weibo.com,https://weibo.com/2649627603/yucPxmSVF
48,科育社区防汛安全知识 67676767,否,,2012-07-26 10:37,转发,评论,赞,微博 weibo.com,https://weibo.com/2649627603/yucLN9lI9
49,科育社区居委会在社区展示橱窗内张贴了关于防汛安全知识，请居民朋友注意查看 67676767,否,,2012-07-26 10:29,转发,评论,赞,微博 weibo.com,https://weibo.com/2649627603/yucIP3oMf
50,//@苏樱20112816300663: @中关村科育社区,是,【北京今晚再遇强降雨】今日午后，全市或迎新一轮强降雨，最大降水出现在东部地区，可能达到中到大雨，不排除个别区域出现暴雨。提醒市民，今天晚高峰可能受到降雨影响，应尽早做好防雨防雷及预防次生灾害的准备。根据上次降雨，@新京报 为大家制作了详细的城市道路积水分布图，并提醒大家出门带好雨具 67676767,2012-07-26 10:27,转发,评论,赞,微博 weibo.com,https://weibo.com/2649627603/yucHO6BBJ
51,今日午后，全市或迎新一轮强降雨，最大降水出现在东部地区，可能达到中到大雨，不排除个别区域出现暴雨。提醒市民，今天晚高峰可能受到降雨影响，应尽早做好防雨防雷及预防次生灾害的准备。 67676767,否,,2012-07-25 11:17,转发,评论,赞,微博 weibo.com,https://weibo.com/2649627603/yu3BCCRKY
52,"科育社区党支部于2012年7月24日上午在科育社区居委会门前召开了关于学习贯彻十一次党代会精神,并由管片儿民警赵立祥讲述治安问题,让居民做好安全防范工作. 67676767",否,,2012-07-24 09:59,1,评论,赞,微博 weibo.com,https://weibo.com/2649627603/ytTFrCPBv
53,"科育社区居委会于2012年7月23日召开了计生宣传会，为计生宣传员发放补贴费用,会上对优秀计生宣传员提出表扬并对下半年工作提出部署及安排. 67676767",否,,2012-07-24 09:51,转发,评论,赞,微博 weibo.com,https://weibo.com/2649627603/ytTCurMy7
54,//@中关村黄庄社区: 转发微博,是,"2012年兵役登记工作开始了，请本社区的年满18周岁的男性公民（2012年12月31日以前）在海淀区征兵网http//zb.bjhd.gov.cn登记。输入用户名和密码（用户名admin,密码admin）咨询电话：010-62550696。年满19至22岁没有参加过兵役登记的公民，请及时在海淀征兵网补登。登（补）记时间：2012-7-20至8-15。 67676767",2012-07-23 16:53,转发,评论,赞,微博 weibo.com,https://weibo.com/2649627603/ytMXdrXIP
55,关于中关村街道社区服务中心“老年人就近修脚服务”通知：社区服务中心定于7月31日（周二）下午，开展服务商进社区一老年人就近修脚服务，请科育社区居民及时报名。请于7月29日前到科育社区居委会报名，报名电话：62563398 67676767,否,,2012-07-23 15:53,1,1,赞,微博 weibo.com,https://weibo.com/2649627603/ytMyKFcrD
56,关于举办“风雨同舟九十载61同心同行谱华章”暨纪念统一战线确立90周年征文活动的通知。征文体裁不限，内容可以追忆多党合作、社会主义建设等各方面的有关史实、感想；可以宣传统一战线各界人士参政议政、民主监督、服务大局的显著成绩和中国共产党领导的多党合作和政治协商制度的优越性等…… 67676767,否,,2012-07-23 15:49,转发,评论,赞,微博 weibo.com,https://weibo.com/2649627603/ytMxf1S5j
57,关于举办纪念海淀区建区60周年征文活动的通知： 征文要紧紧围绕纪念海淀区建区60周年的主题，通过回顾历史、记录变迁、描绘变化、讴歌发展等形式，重温海淀60年的沧桑巨变和辉煌成就；畅谈投身海淀建设的的心得体会；记录60年来的难忘故事和精彩见闻，讴歌60年来涌现出来的先进典型和感人事迹等。 67676767,否,,2012-07-23 15:35,转发,评论,赞,微博 weibo.com,https://weibo.com/2649627603/ytMrzEI63
58,北京市辖区内相关高校，企事业单位将检验本市籍男性适龄青年的《兵役登记证》，没有《兵役登记证》的不予办理入学，就职手续。 今年全区兵役登记工作从7月20日开始至8月15日结束，咨询电话：62563398 62550696 67676767,否,,2012-07-23 15:35,转发,评论,赞,微博 weibo.com,https://weibo.com/2649627603/ytMrxj1Tk
59,科育社区68楼、73楼平房正在局部道路改造，可能给您出行带来不便，谢谢理解 67676767,否,,2012-07-23 09:38,转发,评论,赞,微博 weibo.com,https://weibo.com/2649627603/ytK6Hk1tw
60,2012年7月18日科育社区又一次对97、98、99楼以及甲乙68楼进行了实有人口登记，得到居民的配合，谢谢大家。 67676767,否,,2012-07-19 16:05,转发,评论,赞,微博 weibo.com,https://weibo.com/2649627603/ytaVK67ga
61,"我的微博影响力49,并点亮了影响力铜牌,@苏樱20112816300663,你们也点亮了没？羡慕嫉妒恨就不要了，快来看看你的微博影响力能点亮什么样的奖牌吧~链接地址:O网页链接 67676767",否,,2012-07-19 16:02,转发,评论,赞,微数据,https://weibo.com/2649627603/ytaUpo2Yo
62,针对科育社区流动人口流动量大的问题，科育社区居委会联合中关村派出所、街道流动人口管理办公室协管员，于2012年7月18日晚对居住在科育社区内的流动人口进行第三波查漏补缺工作。此次查漏补缺工作效果明显，彻查出许多遗漏的流动人口及变更的流动人口。 67676767,否,,2012-07-19 14:36,3,评论,赞,微博 weibo.com,https://weibo.com/2649627603/ytalmzRuC
63,放暑假了，参加社区公益劳动的同学，请来社区报名 67676767,否,,2012-07-17 10:58,转发,评论,赞,微博 weibo.com,https://weibo.com/2649627603/ysQ47gJUa
64,请感兴趣的朋友前往，感受中国文化//@文化北京:  7月大栅栏老字号体验计划,是,【大栅栏琉璃厂老字号体验系列活动7月活动预告】 67676767,2012-07-16 09:34,转发,评论,赞,微博 weibo.com,https://weibo.com/2649627603/ysG5gd6Ye
65,垃圾分类从我做起,是,,2012-07-16 09:04,转发,1,赞,微博 weibo.com,https://weibo.com/2649627603/ysFTieqR3
66,2012年7月27日，科育社区在96楼健身乐园继续发放环保垃圾袋，请没有领取的家庭到时候领取。 67676767,否,,2012-07-09 15:10,转发,评论,赞,微博 weibo.com,https://weibo.com/2649627603/yrEimtvnw
67,转发微博,是,#海淀人物# 【社区当家人】“做基层工作老呆在办公室里，你知道老百姓有什么需求，有什么事啊？”紫竹院街道车南里社区居委会主任吕清这样告诉我们，身为社区带头人，她对这个社区所投入的感情是难以言表的，社区里的大事小情如数家珍……O网页链接 67676767,2012-07-09 14:50,转发,评论,赞,微博 weibo.com,https://weibo.com/2649627603/yrEa5bHnZ
68,7月4日，在“聪慧儿快成长宝宝大赛”活动中，科育社区88楼小朋友荣获中关村街道特等奖，还有其他几位小朋友荣获小勇士奖。欢迎大家在今后的活动中积极报名参与。 67676767,否,,2012-07-06 16:00,转发,评论,赞,微博 weibo.com,https://weibo.com/2649627603/yrcl3BLBZ
69,2012年7月6日，上午9：30分，科育社区垃圾分类宣传，请居民踊跃参加。活动中发放垃圾袋，进行人口登记，请大家配合。 67676767,否,,2012-07-05 16:23,转发,评论,赞,微博 weibo.com,https://weibo.com/2649627603/yr346lO4v
